post_id,title,subreddit,score,num_comments,author,collected_at,engagement,is_popular
47609294,The Claude Code Leak,technology,88,40,mergesort,2026-04-02 11:51:01,0.449438202247191,False
47609564,Steam on Linux Use Skyrocketed Above 5% in March,sports,149,57,hkmaxpro,2026-04-02 11:51:04,0.38,True
47609694,Email obfuscation: What works in 2026?,technology,29,4,jaden,2026-04-02 11:51:06,0.13333333333333333,False
47610336,r/programming bans all discussion of LLM programming,technology,51,15,cryptoz,2026-04-02 11:51:07,0.28846153846153844,False
47609752,The future of code search is not regex – 100x faster than ripgrep,technology,17,8,neogoose,2026-04-02 11:51:09,0.4444444444444444,False
47557921,Show HN: Git bayesect – Bayesian Git bisection for non-deterministic bugs,entertainment,252,38,hauntsaninja,2026-04-02 11:51:11,0.15019762845849802,True
47603737,AI for American-produced cement and concrete,technology,182,109,latchkey,2026-04-02 11:51:13,0.5956284153005464,True
47609725,Show HN: NASA Artemis II Mission Timeline Tracker,science,14,2,AustinDev,2026-04-02 11:51:13,0.13333333333333333,False
47596739,Mercor says it was hit by cyberattack tied to compromise LiteLLM,technology,5,0,jackson-mcd,2026-04-02 11:51:15,0.0,False
47558531,AI Perfected Chess. Humans Made It Unpredictable Again,technology,8,1,GMoromisato,2026-04-02 11:51:16,0.1111111111111111,False
47605677,Signing data structures the wrong way,technology,93,42,malgorithms,2026-04-02 11:51:17,0.44680851063829785,False
47606560,"Show HN: Dull – Instagram Without Reels, YouTube Without Shorts (iOS)",entertainment,67,52,kasparnoor,2026-04-02 11:51:19,0.7647058823529411,False
47557385,The revenge of the data scientist,technology,131,27,hamelsmu,2026-04-02 11:51:21,0.20454545454545456,True
47604155,SpaceX files to go public,science,282,370,nutjob2,2026-04-02 11:51:25,1.3074204946996466,True
47607394,SolveSpace (open source 2D/3D CAD) working on Windows 2000 (2025),science,30,6,ruevs,2026-04-02 11:51:28,0.1935483870967742,False
47609883,"Salomi, a research repo on extreme low-bit transformer quantization",science,8,2,Edward9055,2026-04-02 11:51:30,0.2222222222222222,False
47603966,Show HN: Flight-Viz – 10K flights on a 3D globe in 3.5MB of Rust+WASM,entertainment,71,37,coolwulf,2026-04-02 11:51:33,0.5138888888888888,False
47572714,Escaping the Ogallala Trap,technology,10,11,surprisetalk,2026-04-02 11:51:34,1.0,False
47565307,Windows 95 defenses against installers that overwrite a file with an older one,technology,142,70,michelangelo,2026-04-02 11:51:37,0.48951048951048953,True
47599510,"Random numbers, Persian code: A mysterious signal transfixes radio sleuths",technology,112,113,thinkingemote,2026-04-02 11:51:38,1.0,True
47608155,"ZomboCom stolen by a hacker, sold, now replaced with AI-generated makeover",technology,65,28,bananaboy,2026-04-02 11:51:39,0.42424242424242425,False
47572878,How-to guide: Commissioning a Sensor Physics R&D Lab,science,38,4,MagneLauritzen,2026-04-02 11:51:39,0.10256410256410256,False
47571183,Show HN: CLI to order groceries via reverse-engineered REWE API (Haskell),technology,189,78,wazHFsRy,2026-04-02 11:51:43,0.4105263157894737,True
47609372,"Show HN: Semantic atlas of 188 constitutions in 3D (30k articles, embeddings)",entertainment,5,1,joaoli131,2026-04-02 11:51:45,0.16666666666666666,False
47574871,"Show HN: Zerobox – Sandbox any command with file, network, credential controls",entertainment,118,85,afshinmeh,2026-04-02 11:51:45,0.7142857142857143,True
47565350,An Introduction to Writing Systems and Unicode,technology,61,12,mariuz,2026-04-02 11:51:53,0.1935483870967742,False
47608130,Montana referendum to outlaw corporate campaign contributions [video],technology,50,8,le-mark,2026-04-02 11:51:55,0.1568627450980392,False
47609757,Why Iran targeted Amazon data centers,technology,10,4,throwaway2037,2026-04-02 11:51:58,0.36363636363636365,False
47604245,Ukrainian drone holds position for 6 weeks,technology,142,160,AftHurrahWinch,2026-04-02 11:52:00,1.118881118881119,True
47592755,OpenAI closes funding round at an $852B valuation,technology,515,485,surprisetalk,2026-04-02 11:52:01,0.939922480620155,True
47604218,The AI Marketing BS Index,technology,96,19,speckx,2026-04-02 11:52:02,0.1958762886597938,False
47602986,Show HN: Real-time dashboard for Claude Code agent teams,technology,71,22,simple10,2026-04-02 11:52:03,0.3055555555555556,False
47603131,Google Cloud: Investing in the Future of PostgreSQL,technology,24,7,kevincox,2026-04-02 11:52:04,0.28,False
47558733,From 300KB to 69KB per Token: How LLM Architectures Solve the KV Cache Problem,technology,155,11,future-shock-ai,2026-04-02 11:52:08,0.07051282051282051,True
47604768,Comparing C/C++ unity build with regular build on a large codebase (2024),technology,11,2,PaulHoule,2026-04-02 11:52:10,0.16666666666666666,False
47589856,Show HN: Postgres extension for BM25 relevance-ranked full-text search,entertainment,188,57,tjgreen,2026-04-02 11:52:21,0.30158730158730157,True
47607775,"""Special 301"" Comments on Nintendo Game Piracy in Asia and Latin America (1994)",sports,7,0,Lammy,2026-04-02 11:52:24,0.0,False
47541746,Show HN: Forkrun – NUMA-aware shell parallelizer (50×–400× faster than parallel),worldnews,144,39,jkool702,2026-04-02 11:52:29,0.2689655172413793,True
47601310,"Iran war sparks renewables boom as Europeans rush to buy solar, heat pumps, EVs",worldnews,80,97,vrganj,2026-04-02 11:52:32,1.1975308641975309,False
47588349,GitHub Monaspace Case Study,science,144,48,homebrewer,2026-04-02 11:52:41,0.3310344827586207,True
47586614,Open source CAD in the browser (Solvespace),science,364,123,phkahler,2026-04-02 11:52:50,0.336986301369863,True
47562342,Digitizing photos from the 1998 Game Boy Camera,sports,68,15,rockbruno,2026-04-02 11:52:52,0.21739130434782608,False
47577761,Fedware: Government apps that spy harder than the apps they ban,worldnews,678,274,speckx,2026-04-02 11:52:53,0.40353460972017674,True
47578086,Vulnerability research is cooked,science,252,168,pedro84,2026-04-02 11:52:57,0.6640316205533597,True
47608790,The Longest-Running Vaporware Project in the History of Computing,worldnews,12,2,YounesDz,2026-04-02 11:53:12,0.15384615384615385,False
47603534,A new way to measure poverty shows the US falling behind Europe,entertainment,90,76,_DeadFred_,2026-04-02 11:53:25,0.8351648351648352,False
47555035,"Show HN: Loreline, narrative language transpiled via Haxe: C++/C#/JS/Java/Py/Lua",entertainment,70,20,jeremyfa,2026-04-02 11:53:28,0.28169014084507044,False
47548164,"Researchers find 3,500-year-old loom that reveals textile revolution",science,132,19,geox,2026-04-02 11:53:39,0.14285714285714285,True
47578572,Turning a MacBook into a touchscreen with $1 of hardware (2018),worldnews,406,227,HughParry,2026-04-02 11:53:48,0.5577395577395577,True
47588324,Show HN: Sundial – a new way to look at a weather forecast,entertainment,56,24,izaidi,2026-04-02 11:54:06,0.42105263157894735,False
47566143,My MacBook keyboard is broken and it's insanely expensive to fix,entertainment,381,532,TobiasBerg,2026-04-02 11:54:07,1.3926701570680629,True
47605132,"SpaceX files for IPO, targets $1.75T valuation",science,11,2,AndrewDucker,2026-04-02 11:54:47,0.16666666666666666,False
47598415,A million new SpaceX satellites will destroy the night sky,science,48,37,01-_-,2026-04-02 11:54:53,0.7551020408163265,False
47575403,CodingFont: A game to help you pick a coding font,sports,488,236,nvahalik,2026-04-02 11:54:57,0.48261758691206547,True
47585860,"In Expanding de Sitter Space, Quantum Mechanics Gets More Elusive",science,32,2,pseudolus,2026-04-02 11:55:10,0.06060606060606061,False
47557299,Hardware Image Compression,worldnews,72,15,luu,2026-04-02 11:55:22,0.2054794520547945,False
47558094,Show HN: QuickBEAM – run JavaScript as supervised Erlang/OTP processes,entertainment,110,16,dannote,2026-04-02 11:56:14,0.14414414414414414,True
47605235,NASA's Artemis II Crew Launches to the Moon (Official Broadcast) [video],science,5,1,twalichiewicz,2026-04-02 11:56:18,0.16666666666666666,False
47567049,Show HN: Crazierl – An Erlang Operating System,entertainment,72,14,toast0,2026-04-02 11:57:02,0.1917808219178082,False
47540833,Hold on to Your Hardware,worldnews,661,533,LucidLynx,2026-04-02 11:57:04,0.8051359516616314,True
47603696,Pesticides and cancer: researchers find a connection at the national level,science,6,1,MrDresden,2026-04-02 11:57:05,0.14285714285714285,False
47590153,Facial Recognition Errors Affect Millions Globally,worldnews,6,0,pseudolus,2026-04-02 11:57:12,0.0,False
47589451,Show HN: Hyprmoncfg – Terminal-based monitor config manager for Hyprland,entertainment,11,4,earcar,2026-04-02 11:57:17,0.3333333333333333,False
47603123,Show HN: Aphelo – A Redis-like store in C++ with Progressive Rehashing,entertainment,5,1,pranit_garje,2026-04-02 11:57:25,0.16666666666666666,False
47563103,"Show HN: BreezePDF – Free, in-browser PDF editor",entertainment,96,46,philjohnson,2026-04-02 11:57:31,0.4742268041237113,False
47587191,Show HN: Rust UEFI UI Lib,entertainment,6,2,supernihil,2026-04-02 11:57:43,0.2857142857142857,False
47595721,Iran's Revolutionary Guards Declares War on Silicon Valley,worldnews,18,12,mikelgan,2026-04-02 11:57:44,0.631578947368421,False
47592280,Show HN: Multi-agent autoresearch for ANE inference beats Apple's CoreML by 6×,science,6,0,christinetyip,2026-04-02 11:57:50,0.0,False
47604354,TurboQuant KV Compression and SSD Expert Streaming for M5 Pro and IOS,entertainment,76,46,aegis_camera,2026-04-02 11:57:51,0.5974025974025974,False
47601957,Launch day has arrived for NASA's Artemis II mission–here's what to expect,science,5,0,Archelaos,2026-04-02 11:57:55,0.0,False
47565831,"Show HN: I made a ""programming language"" looking for feedback",entertainment,37,39,alonsovm,2026-04-02 11:57:58,1.0263157894736843,False
47556033,rpg.actor Game Jam,sports,80,6,Kye,2026-04-02 11:58:13,0.07407407407407407,False
47571401,Show HN: The Alphabetical Clock,entertainment,40,24,secretdark,2026-04-02 11:58:17,0.5853658536585366,False
47601055,Mapping pesticides to cancer risk at the country scale with spatial exposomics,worldnews,6,0,bonsai_spool,2026-04-02 11:58:18,0.0,False
47575910,Show HN: A 3D Body Scan for Nine Cents – Without SMPL,entertainment,17,4,arkadiuss,2026-04-02 11:58:19,0.2222222222222222,False
47589900,Show HN: Lazy-tool: reducing prompt bloat in MCP-based agent workflows,entertainment,21,2,like-to-code1,2026-04-02 11:58:20,0.09090909090909091,False
47546911,Capability-Based Security for Redox: Namespace and CWD as Capabilities,science,64,9,ejplatzer,2026-04-02 11:58:32,0.13846153846153847,False
47596125,Intel SGX: Global Wrapping Key Extracted,worldnews,17,3,fogzen,2026-04-02 11:58:41,0.16666666666666666,False
47593627,NASA Teams Readying Artemis II Moon Rocket for Launch,sports,11,0,benlarweh,2026-04-02 11:58:47,0.0,False
47605000,Hegseth attempted to make large investments in defense companies before Iran War,worldnews,12,0,doener,2026-04-02 11:59:05,0.0,False
47571705,Sad Story of Soviet Compact Disc Players,sports,9,1,thenthenthen,2026-04-02 11:59:24,0.1,False
47549160,Show HN: Twitch Roulette – Find live streamers who need views the most,entertainment,179,94,ellg,2026-04-02 11:59:29,0.5222222222222223,True
47563177,"Show HN: Payphone Tag is territory game using Australia's 15,000 payphones",sports,20,9,gangerang,2026-04-02 11:59:47,0.42857142857142855,False
